{
 "bible_id": "IPB-0001",
 "canon": {
  "characters": [
   {
    "archetype": "patient steward who measures twice",
    "authenticity_label": "Original character, self-produced concept data, AI-assisted draft reviewed by a human content reviewer.",
    "character_id": "CHR-MU",
    "content_review_ref": "CRV-0001",
    "element": "wood",
    "licence_safe_sourcing": "self_produced",
    "motifs": [
     "mortise-and-tenon lattice",
     "rice ear",
     "cloud scroll"
    ],
    "name": {
     "en": "A-Mu",
     "zh": "阿木"
    },
    "palette": [
     "#3F5B43",
     "#8C6A3F",
     "#E7D8B8",
     "#C9A227",
     "#1F2A44"
    ],
    "personality": {
     "axes": [
      {
       "axis": "warmth",
       "value_bp": 7800
      },
      {
       "axis": "order",
       "value_bp": 8800
      },
      {
       "axis": "energy",
       "value_bp": 4200
      },
      {
       "axis": "candour",
       "value_bp": 6100
      }
     ]
    },
    "props": [
     "brass try square",
     "linen measure cord"
    ],
    "relationships": [
     {
      "kind": "sibling",
      "note": "Raised in the same workshop street; they disagree like two hands of the same craft.",
      "to_character_id": "CHR-HUO"
     }
    ],
    "role": "guardian of grain and timber",
    "silhouette": "A tall hooded figure with square shoulders, a long apron of carved panels and a hem that widens like a tree root.",
    "story_arc": [
     {
      "beat": "the silent kiln",
      "summary": "A-Mu finds the kiln cold for the first time in living memory and assumes the fire guardian has abandoned the village."
     },
     {
      "beat": "the unfinished panel",
      "summary": "A-Mu refuses to finish a commissioned panel because the grain needs fire to set the inlay; the buyer walks away."
     },
     {
      "beat": "the shared bench",
      "summary": "A-Mu walks to the kiln with a half-carved panel, and the two guardians build one bench where wood and fire are finished together."
     }
    ],
    "taboos": [
     "never cuts a living tree for a commission",
     "never signs a piece that a craftsperson did not finish"
    ],
    "voice": {
     "pace": "measured",
     "register": "warm",
     "signature_line": "Measure twice, and let the wood keep the second measure."
    }
   },
   {
    "archetype": "restless maker who listens to the kiln",
    "authenticity_label": "Original character, self-produced concept data, AI-assisted draft reviewed by a human content reviewer.",
    "character_id": "CHR-HUO",
    "content_review_ref": "CRV-0002",
    "element": "fire",
    "licence_safe_sourcing": "self_produced",
    "motifs": [
     "crackle glaze",
     "flame wave",
     "peony roundel"
    ],
    "name": {
     "en": "A-Huo",
     "zh": "阿火"
    },
    "palette": [
     "#8E3B2F",
     "#D9822B",
     "#F2C14E",
     "#2B2B2B",
     "#E7D8B8"
    ],
    "personality": {
     "axes": [
      {
       "axis": "warmth",
       "value_bp": 6400
      },
      {
       "axis": "order",
       "value_bp": 4800
      },
      {
       "axis": "energy",
       "value_bp": 9100
      },
      {
       "axis": "candour",
       "value_bp": 8800
      }
     ]
    },
    "props": [
     "glaze test tile",
     "long bellows pipe"
    ],
    "relationships": [
     {
      "kind": "sibling",
      "note": "Trusts the wood guardian's patience but not the silence that came with it.",
      "to_character_id": "CHR-MU"
     }
    ],
    "role": "guardian of kiln fire and glaze",
    "silhouette": "A compact figure wrapped in a cracked-glaze mantle, with one sleeve wider than the other and a small flame-shaped collar.",
    "story_arc": [
     {
      "beat": "the cold kiln",
      "summary": "A-Huo let the fire die to keep the forest from being cut for a season, and cannot explain the choice without sounding like a refusal."
     },
     {
      "beat": "the crackled test",
      "summary": "A single test tile survives the cold kiln with a crackle no one has seen; A-Huo realises the village glaze was waiting for this."
     },
     {
      "beat": "one bench",
      "summary": "A-Huo carries the kiln fire to the wood bench and teaches the finishing step to the village apprentices, finishing A-Mu's half-carved panel."
     }
    ],
    "taboos": [
     "never fires a glaze that copies a protected ritual object",
     "never sells a second firing without telling the buyer"
    ],
    "voice": {
     "pace": "brisk",
     "register": "crisp",
     "signature_line": "The kiln does not argue; it answers in colour."
    }
   }
  ]
 },
 "created_at": "2026-10-18T00:00:00Z",
 "heritage_refs": [
  {
   "exclusive_claimed": false,
   "name": "regional mortise-and-tenon joinery technique"
  },
  {
   "exclusive_claimed": false,
   "name": "local kiln-fire glaze technique"
  },
  {
   "exclusive_claimed": false,
   "name": "peony roundel as a shared decorative motif"
  }
 ],
 "title": {
  "en": "The Two Guardians of the Craft Village",
  "zh": "山海双守"
 },
 "usage_plan": {
  "formats": [
   "short_drama",
   "merchandise",
   "exhibition",
   "social"
  ],
  "territories": [
   "CN",
   "EU",
   "US"
  ]
 },
 "version": "1.0.0",
 "world": {
  "conflict": "The kiln guardian has let the fire grow cold to protect the forest, and the wood guardian reads that silence as betrayal; the village loses its glaze and the two stop speaking.",
  "era": "timeless",
  "premise": "A craft village lives by two promises: the forest gives the wood, the kiln gives the colour. Two guardians keep the promises, and when one of them stops listening the village loses half of what it knows.",
  "resolution_theme": "The two crafts are one practice: the wood needs the fire to finish it, and the fire needs the wood to be worth burning.",
  "rules": [
   "A guardian may borrow a motif from the village, but may never claim a traditional prototype as private property.",
   "Every piece made under a guardian's name carries the name of the craftsperson who finished it.",
   "When a guardian takes, the guardian must also teach; craft knowledge never leaves the village without a student."
  ],
  "setting": {
   "en": "A craft village between a mountain range and a bay. By day the woodworking and jewellery workshops share one street; by night the kiln fire and the mountain wind take turns watching over the village. Two guardians are said to keep it: one of timber and grain, one of kiln fire and glaze.",
   "zh": "群山与海湾之间的一个手艺村。白天，木作与首饰工坊共用一条街；夜里，窑火与山风轮流守着村子。传说有两位守护者，一个守着木材与纹理，一个守着窑火与釉色。"
  }
 }
}
